[
  {
    "source_image_url": "https://dm.takaratomy.co.jp/wp-content/themes/dm2019/img/product/dm26ex2/all-precedence/001.jpg",
    "card_number": "SPR1/SPR5",
    "card_name": "瀑水神 ミヅハノオオミカミ",
    "civilization": null,
    "cost": null,
    "card_type": null,
    "rarity": null,
    "is_twinpact": false,
    "illustration_variant": "special_illustration",
    "finish_variant": null,
    "review_status": "variant_only",
    "review_note": "公式画像で名称を確認。特殊番号と分類は公式画像を優先しDMWikiの収録一覧で照合。通常版との同一性はカード名だけでは確定しない。",
    "field_sources": {
      "card_number": "official",
      "card_name": "official",
      "rarity": "unresolved",
      "civilization": "unresolved",
      "cost": "unresolved",
      "card_type": "unresolved"
    },
    "source_conflict": false,
    "source_conflict_note": null
  },
  {
    "source_image_url": "https://dm.takaratomy.co.jp/wp-content/themes/dm2019/img/product/dm26ex2/all-precedence/002.jpg",
    "card_number": "SPR2/SPR5",
    "card_name": "世界竜皇 ボルシャック・ヒカリスマ",
    "civilization": null,
    "cost": null,
    "card_type": null,
    "rarity": null,
    "is_twinpact": false,
    "illustration_variant": "special_illustration",
    "finish_variant": null,
    "review_status": "variant_only",
    "review_note": "公式画像で名称を確認。特殊番号と分類は公式画像を優先しDMWikiの収録一覧で照合。通常版との同一性はカード名だけでは確定しない。",
    "field_sources": {
      "card_number": "official",
      "card_name": "official",
      "rarity": "unresolved",
      "civilization": "unresolved",
      "cost": "unresolved",
      "card_type": "unresolved"
    },
    "source_conflict": false,
    "source_conflict_note": null
  },
  {
    "source_image_url": "https://dm.takaratomy.co.jp/wp-content/themes/dm2019/img/product/dm26ex2/all-precedence/003.jpg",
    "card_number": "SPR3/SPR5",
    "card_name": "邪眼魔凰デス・フェニックス",
    "civilization": null,
    "cost": null,
    "card_type": null,
    "rarity": null,
    "is_twinpact": false,
    "illustration_variant": "special_illustration",
    "finish_variant": null,
    "review_status": "variant_only",
    "review_note": "公式画像で名称を確認。特殊番号と分類は公式画像を優先しDMWikiの収録一覧で照合。通常版との同一性はカード名だけでは確定しない。",
    "field_sources": {
      "card_number": "official",
      "card_name": "official",
      "rarity": "unresolved",
      "civilization": "unresolved",
      "cost": "unresolved",
      "card_type": "unresolved"
    },
    "source_conflict": false,
    "source_conflict_note": null
  },
  {
    "source_image_url": "https://dm.takaratomy.co.jp/wp-content/themes/dm2019/img/product/dm26ex2/all-precedence/004.jpg",
    "card_number": "SPR4/SPR5",
    "card_name": "SSS級侵略 カリスマゾーン",
    "civilization": null,
    "cost": null,
    "card_type": null,
    "rarity": null,
    "is_twinpact": false,
    "illustration_variant": "special_illustration",
    "finish_variant": null,
    "review_status": "variant_only",
    "review_note": "公式画像で名称を確認。特殊番号と分類は公式画像を優先しDMWikiの収録一覧で照合。通常版との同一性はカード名だけでは確定しない。",
    "field_sources": {
      "card_number": "official",
      "card_name": "official",
      "rarity": "unresolved",
      "civilization": "unresolved",
      "cost": "unresolved",
      "card_type": "unresolved"
    },
    "source_conflict": false,
    "source_conflict_note": null
  },
  {
    "source_image_url": "https://dm.takaratomy.co.jp/wp-content/themes/dm2019/img/product/dm26ex2/all-precedence/005.jpg",
    "card_number": "SPR5/SPR5",
    "card_name": "CRY-S-MAX ジャオウガ",
    "civilization": null,
    "cost": null,
    "card_type": null,
    "rarity": null,
    "is_twinpact": false,
    "illustration_variant": "special_illustration",
    "finish_variant": null,
    "review_status": "variant_only",
    "review_note": "公式画像で名称を確認。特殊番号と分類は公式画像を優先しDMWikiの収録一覧で照合。通常版との同一性はカード名だけでは確定しない。",
    "field_sources": {
      "card_number": "official",
      "card_name": "official",
      "rarity": "unresolved",
      "civilization": "unresolved",
      "cost": "unresolved",
      "card_type": "unresolved"
    },
    "source_conflict": false,
    "source_conflict_note": null
  },
  {
    "source_image_url": "https://dm.takaratomy.co.jp/wp-content/themes/dm2019/img/product/dm26ex2/all-precedence/006.jpg",
    "card_number": "PR1/PR10",
    "card_name": "引き裂かれし永劫、エムラクール",
    "civilization": null,
    "cost": null,
    "card_type": null,
    "rarity": "キャラプレミアムトレジャー",
    "is_twinpact": false,
    "illustration_variant": "special_illustration",
    "finish_variant": null,
    "review_status": "variant_only",
    "review_note": "公式画像で名称を確認。特殊番号と分類は公式画像を優先しDMWikiの収録一覧で照合。通常版との同一性はカード名だけでは確定しない。",
    "field_sources": {
      "card_number": "official",
      "card_name": "official",
      "rarity": "official",
      "civilization": "unresolved",
      "cost": "unresolved",
      "card_type": "unresolved"
    },
    "source_conflict": false,
    "source_conflict_note": null
  },
  {
    "source_image_url": "https://dm.takaratomy.co.jp/wp-content/themes/dm2019/img/product/dm26ex2/all-precedence/007.jpg",
    "card_number": "PR2/PR10",
    "card_name": "龍頭星雲人／零誕祭",
    "civilization": null,
    "cost": null,
    "card_type": "ツインパクト",
    "rarity": "キャラプレミアムトレジャー",
    "is_twinpact": true,
    "illustration_variant": "special_illustration",
    "finish_variant": null,
    "review_status": "variant_only",
    "review_note": "公式画像で名称を確認。特殊番号と分類は公式画像を優先しDMWikiの収録一覧で照合。通常版との同一性はカード名だけでは確定しない。",
    "field_sources": {
      "card_number": "official",
      "card_name": "official",
      "rarity": "official",
      "civilization": "unresolved",
      "cost": "unresolved",
      "card_type": "official"
    },
    "source_conflict": false,
    "source_conflict_note": null
  },
  {
    "source_image_url": "https://dm.takaratomy.co.jp/wp-content/themes/dm2019/img/product/dm26ex2/all-precedence/008.jpg",
    "card_number": "PR3/PR10",
    "card_name": "超神星DOOM・ドラゲリオン",
    "civilization": null,
    "cost": null,
    "card_type": null,
    "rarity": "キャラプレミアムトレジャー",
    "is_twinpact": false,
    "illustration_variant": "special_illustration",
    "finish_variant": null,
    "review_status": "variant_only",
    "review_note": "公式画像で名称を確認。特殊番号と分類は公式画像を優先しDMWikiの収録一覧で照合。通常版との同一性はカード名だけでは確定しない。",
    "field_sources": {
      "card_number": "official",
      "card_name": "official",
      "rarity": "official",
      "civilization": "unresolved",
      "cost": "unresolved",
      "card_type": "unresolved"
    },
    "source_conflict": false,
    "source_conflict_note": null
  },
  {
    "source_image_url": "https://dm.takaratomy.co.jp/wp-content/themes/dm2019/img/product/dm26ex2/all-precedence/009.jpg",
    "card_number": "PR4/PR10",
    "card_name": "アーテル・ゴルギーニ",
    "civilization": null,
    "cost": null,
    "card_type": null,
    "rarity": "キャラプレミアムトレジャー",
    "is_twinpact": false,
    "illustration_variant": "special_illustration",
    "finish_variant": null,
    "review_status": "variant_only",
    "review_note": "公式画像で名称を確認。特殊番号と分類は公式画像を優先しDMWikiの収録一覧で照合。通常版との同一性はカード名だけでは確定しない。",
    "field_sources": {
      "card_number": "official",
      "card_name": "official",
      "rarity": "official",
      "civilization": "unresolved",
      "cost": "unresolved",
      "card_type": "unresolved"
    },
    "source_conflict": false,
    "source_conflict_note": null
  },
  {
    "source_image_url": "https://dm.takaratomy.co.jp/wp-content/themes/dm2019/img/product/dm26ex2/all-precedence/010.jpg",
    "card_number": "PR5/PR10",
    "card_name": "轟轟合体 ゴルギーオージャー",
    "civilization": null,
    "cost": null,
    "card_type": null,
    "rarity": "キャラプレミアムトレジャー",
    "is_twinpact": false,
    "illustration_variant": "special_illustration",
    "finish_variant": null,
    "review_status": "variant_only",
    "review_note": "公式画像で名称を確認。特殊番号と分類は公式画像を優先しDMWikiの収録一覧で照合。通常版との同一性はカード名だけでは確定しない。",
    "field_sources": {
      "card_number": "official",
      "card_name": "official",
      "rarity": "official",
      "civilization": "unresolved",
      "cost": "unresolved",
      "card_type": "unresolved"
    },
    "source_conflict": false,
    "source_conflict_note": null
  },
  {
    "source_image_url": "https://dm.takaratomy.co.jp/wp-content/themes/dm2019/img/product/dm26ex2/all-precedence/011.jpg",
    "card_number": "PR6/PR10",
    "card_name": "一音の妖精",
    "civilization": null,
    "cost": null,
    "card_type": null,
    "rarity": "キャラプレミアムトレジャー",
    "is_twinpact": false,
    "illustration_variant": "special_illustration",
    "finish_variant": null,
    "review_status": "variant_only",
    "review_note": "公式画像で名称を確認。特殊番号と分類は公式画像を優先しDMWikiの収録一覧で照合。通常版との同一性はカード名だけでは確定しない。",
    "field_sources": {
      "card_number": "official",
      "card_name": "official",
      "rarity": "official",
      "civilization": "unresolved",
      "cost": "unresolved",
      "card_type": "unresolved"
    },
    "source_conflict": false,
    "source_conflict_note": null
  },
  {
    "source_image_url": "https://dm.takaratomy.co.jp/wp-content/themes/dm2019/img/product/dm26ex2/all-precedence/012.jpg",
    "card_number": "PR7/PR10",
    "card_name": "ブレイン・スラッシュ",
    "civilization": null,
    "cost": null,
    "card_type": null,
    "rarity": "キャラプレミアムトレジャー",
    "is_twinpact": false,
    "illustration_variant": "special_illustration",
    "finish_variant": null,
    "review_status": "variant_only",
    "review_note": "公式画像で名称を確認。特殊番号と分類は公式画像を優先しDMWikiの収録一覧で照合。通常版との同一性はカード名だけでは確定しない。",
    "field_sources": {
      "card_number": "official",
      "card_name": "official",
      "rarity": "official",
      "civilization": "unresolved",
      "cost": "unresolved",
      "card_type": "unresolved"
    },
    "source_conflict": false,
    "source_conflict_note": null
  },
  {
    "source_image_url": "https://dm.takaratomy.co.jp/wp-content/themes/dm2019/img/product/dm26ex2/all-precedence/013.jpg",
    "card_number": "PR8/PR10",
    "card_name": "百鬼の邪王門",
    "civilization": null,
    "cost": null,
    "card_type": null,
    "rarity": "キャラプレミアムトレジャー",
    "is_twinpact": false,